<?xml version="1.0" encoding="UTF-8"?>
<warehouse xmlns:xsi="http://www.w3.org/2001/XMLSchema-instance"
           xsi:noNamespaceSchemaLocation="warehouse_inventory.xsd">
  <id>ABC1234</id>
  <categories>
    <category>
      <name>Electronics</name>
      <products>
        <product>
          <code>PRD-001-XYZ</code>
          <description>Smartphone</description>
          <price>699.99</price>
          <quantity>50</quantity>
          <expiryDate>2026-12-31</expiryDate>
        </product>
        <product>
          <code>PRD-002-XYZ</code>
          <description>Laptop</description>
          <price>999.99</price>
          <quantity>30</quantity>
        </product>
      </products>
    </category>
    <category>
      <name>Groceries</name>
      <products>
        <product>
          <code>PRD-101-ABC</code>
          <description>Milk</description>
          <price>1.50</price>
          <quantity>200</quantity>
          <expiryDate>2024-01-15</expiryDate>
        </product>
      </products>
    </category>
  </categories>
  <operations>
    <operation>
      <date>2025-01-05</date>
      <time>10:30:00</time>
      <productCode>PRD-001-XYZ</productCode>
      <quantity>10</quantity>
      <type>USCITA</type>
    </operation>
    <operation>
      <date>2025-01-06</date>
      <time>14:00:00</time>
      <productCode>PRD-101-ABC</productCode>
      <quantity>50</quantity>
      <type>ENTRATA</type>
    </operation>
  </operations>
</warehouse>
